{
  "schema_version": "fsl-causal-evidence.v0",
  "evidence_id": "EXP_ONBOARDING_2026",
  "claims": [
    {
      "id": "claim:C_Onboarding_FirstSuccess",
      "version": 1
    }
  ],
  "design": "randomized_experiment",
  "source_study_id": "STUDY_ONBOARDING_2026",
  "derived_from": [],
  "support": "supports",
  "scope": {
    "population": ["new_users"],
    "environment": ["production"],
    "segment": ["self_serve"]
  },
  "period": {
    "start": "2026-01-01",
    "end": "2026-03-31",
    "valid_until": "2027-03-31"
  },
  "estimate": {
    "estimand": "risk_difference",
    "value": 0.08,
    "lower": 0.03,
    "upper": 0.13,
    "confidence": 0.95
  },
  "assumptions": ["randomization_integrity", "no_interference"],
  "observation": null,
  "artifact_digest": "sha256:0000000000000000000000000000000000000000000000000000000000000000",
  "formal_result": "not_run"
}
